{
  "id": "2763515c-30d8-4d7e-bdd1-f6e67db22632",
  "title": "🌲 Лес",
  "description": "A test story.",
  "startId": 1,
  "prefix": "День: {{day}}",
  "data": {
    "init": {
      "day": 1
    },
    "effects": [
      {
        "name": "nextDay",
        "statements": "day = day + 1"
      }
    ]
  },
  "position": [10, 100],
  "nodes": [
    {
      "id": 1,
      "type": "action",
      "position": [300, 100],
      "text": "Вы гуляли по лесу 🌲🌲🌲 и заблудились. 😮",
      "actions": [
        {
          "id": 5,
          "label": "Сесть на пенек и заплакать"
        },
        {
          "id": 3,
          "label": "Попытаться найти выход"
        }
      ]
    },
    {
      "id": 2,
      "type": "finish",
      "position": [1100, 300],
      "text": "Вы умерли от <b>голода</b>. 💀"
    },
    {
      "id": 3,
      "type": "redirect",
      "position": [700, 450],
      "text": "Вы долго бродили по лесу 🌲🌲🌲 в поисках выхода.",
      "links": [
        {
          "id": 1,
          "weight": 4
        },
        {
          "id": 4,
          "weight": 1
        }
      ]
    },
    {
      "id": 4,
      "type": "finish",
      "position": [1100, 450],
      "text": "Вы нашли дорогу и выбрались из леса. 🎉🎉🎉"
    },
    {
      "id": 5,
      "type": "redirect",
      "position": [700, 100],
      "text": "Вы сели на пенек, проплакали весь день и уснули. 😴",
      "links": [
        {
          "id": 6,
          "weight": 3
        },
        {
          "id": 7,
          "weight": 2,
          "condition": "day > 3"
        },
        {
          "id": 2,
          "weight": 1
        }
      ],
      "entryEffects": [
        {
          "name": "nextDay"
        }
      ]
    },
    {
      "id": 6,
      "type": "action",
      "position": [300, 400],
      "text": "Проснувшись, вы обнаружили, что вы все еще не знаете, где выход из леса. 😕",
      "actions": [
        {
          "id": 5,
          "label": "Сесть на пенек и заплакать"
        },
        {
          "id": 3,
          "label": "Попытаться найти выход"
        }
      ]
    },
    {
      "id": 7,
      "type": "skip",
      "position": [1100, 50],
      "nextId": 1,
      "text": "Вас разбудила <b>избирательная комиссия</b> 👩‍👩‍👧‍👧, которой понадобился ваш пенек. 🤔 Вам пришлось уйти."
    }
  ]
}
